{
  "$schema": "http://json-schema.org/draft-07/schema#",
  "description": "Official Replicate API schema for black-forest-labs/flux-kontext-max",
  "properties": {
    "seed": {
      "type": "integer",
      "title": "Seed",
      "nullable": true,
      "description": "Random seed. Set for reproducible generation"
    },
    "prompt": {
      "type": "string",
      "title": "Prompt",
      "description": "Text description of what you want to generate, or the instruction on how to edit the given image."
    },
    "input_image": {
      "type": "string",
      "title": "Input Image",
      "format": "uri",
      "nullable": true,
      "description": "Image to use as reference. Must be jpeg, png, gif, or webp."
    },
    "aspect_ratio": {
      "allOf": [
        {
          "$ref": "#/components/schemas/aspect_ratio"
        }
      ],
      "default": "match_input_image",
      "x-order": 2,
      "description": "Aspect ratio of the generated image. Use 'match_input_image' to match the aspect ratio of the input image."
    },
    "output_format": {
      "allOf": [
        {
          "$ref": "#/components/schemas/output_format"
        }
      ],
      "default": "png",
      "x-order": 5,
      "description": "Output format for the generated image"
    },
    "safety_tolerance": {
      "type": "integer",
      "title": "Safety Tolerance",
      "default": 2,
      "maximum": 6,
      "minimum": 0,
      "description": "Safety tolerance, 0 is most strict and 6 is most permissive. 2 is currently the maximum allowed when input images are used."
    },
    "prompt_upsampling": {
      "type": "boolean",
      "title": "Prompt Upsampling",
      "default": false,
      "description": "Automatic prompt improvement"
    }
  },
  "required": ["prompt"],
  "title": "flux-kontext-max Input Schema",
  "type": "object"
}
