{
  "aspect_ratio": "1:1",
  "input_image": "asset_product_123",
  "output_format": "jpg",
  "prompt": "Create a launch image for the new bottle. Reusable bottle. sun-drenched ceramics studio. Centered product portrait. soft window light. Clean editorial product photography. Visible text: NEW. Keep the bottle label readable",
  "prompt_upsampling": false,
  "safety_tolerance": 2,
  "seed": 42
}
